{
  "$schema": "../../../../schemas/reviewer-input.schema.json",
  "schema_version": "1.0.0",
  "review_id": "abk:review:artifact-dag-core-v1-source-native-reviewer-02",
  "campaign_id": "abk:benchmark-campaign:artifact-dag-core-v1",
  "scorecard_id": "abk:scorecard:artifact-dag-core-v1-source-native",
  "rubric_id": "abk:rubric:artifact-dag-core-v1",
  "branch": "source_native",
  "reviewer_key": "reviewer-02",
  "status": "submitted",
  "reviewed_at": "2026-08-05T08:30:00Z",
  "evidence_snapshot_path": "benchmarks/campaigns/artifact-dag-core-v1/runs/full-campaign-20260805/campaign-run-index.json",
  "evidence_snapshot_sha256": "cbbff6d1cee4ec8598425a901c176bc1b281283c4dd542af34f015646d706a10",
  "case_scores": [
    {
      "case_id": "COM-01-normal-primary",
      "dimensions": [
        {
          "dimension_id": "task_success",
          "score": 9,
          "rationale": "task_success is supported by COM-01-normal-primary immutable run evidence. Source-native runs provide hash-verified readiness, provenance, explicit failures and recovery/handoff artifacts; the out-of-root case is correctly rejected as inconclusive.",
          "evidence_ids": [
            "full-campaign-source-native-com-01-normal-primary-r1",
            "full-campaign-source-native-com-01-normal-primary-r2",
            "full-campaign-source-native-com-01-normal-primary-r3"
          ]
        },
        {
          "dimension_id": "correctness_and_evidence",
          "score": 9,
          "rationale": "correctness_and_evidence is supported by COM-01-normal-primary immutable run evidence. Source-native runs provide hash-verified readiness, provenance, explicit failures and recovery/handoff artifacts; the out-of-root case is correctly rejected as inconclusive.",
          "evidence_ids": [
            "full-campaign-source-native-com-01-normal-primary-r1",
            "full-campaign-source-native-com-01-normal-primary-r2",
            "full-campaign-source-native-com-01-normal-primary-r3"
          ]
        },
        {
          "dimension_id": "repeatability",
          "score": 9,
          "rationale": "repeatability is supported by COM-01-normal-primary immutable run evidence. Source-native runs provide hash-verified readiness, provenance, explicit failures and recovery/handoff artifacts; the out-of-root case is correctly rejected as inconclusive.",
          "evidence_ids": [
            "full-campaign-source-native-com-01-normal-primary-r1",
            "full-campaign-source-native-com-01-normal-primary-r2",
            "full-campaign-source-native-com-01-normal-primary-r3"
          ]
        },
        {
          "dimension_id": "state_and_error_observability",
          "score": 9,
          "rationale": "state_and_error_observability is supported by COM-01-normal-primary immutable run evidence. Source-native runs provide hash-verified readiness, provenance, explicit failures and recovery/handoff artifacts; the out-of-root case is correctly rejected as inconclusive.",
          "evidence_ids": [
            "full-campaign-source-native-com-01-normal-primary-r1",
            "full-campaign-source-native-com-01-normal-primary-r2",
            "full-campaign-source-native-com-01-normal-primary-r3"
          ]
        },
        {
          "dimension_id": "stop_and_recovery",
          "score": 9,
          "rationale": "stop_and_recovery is supported by COM-01-normal-primary immutable run evidence. Source-native runs provide hash-verified readiness, provenance, explicit failures and recovery/handoff artifacts; the out-of-root case is correctly rejected as inconclusive.",
          "evidence_ids": [
            "full-campaign-source-native-com-01-normal-primary-r1",
            "full-campaign-source-native-com-01-normal-primary-r2",
            "full-campaign-source-native-com-01-normal-primary-r3"
          ]
        },
        {
          "dimension_id": "context_and_token_efficiency",
          "score": 8,
          "rationale": "context_and_token_efficiency is supported by COM-01-normal-primary immutable run evidence. Source-native runs provide hash-verified readiness, provenance, explicit failures and recovery/handoff artifacts; the out-of-root case is correctly rejected as inconclusive.",
          "evidence_ids": [
            "full-campaign-source-native-com-01-normal-primary-r1",
            "full-campaign-source-native-com-01-normal-primary-r2",
            "full-campaign-source-native-com-01-normal-primary-r3"
          ]
        },
        {
          "dimension_id": "runtime_and_operational_overhead",
          "score": 8,
          "rationale": "runtime_and_operational_overhead is supported by COM-01-normal-primary immutable run evidence. Source-native runs provide hash-verified readiness, provenance, explicit failures and recovery/handoff artifacts; the out-of-root case is correctly rejected as inconclusive.",
          "evidence_ids": [
            "full-campaign-source-native-com-01-normal-primary-r1",
            "full-campaign-source-native-com-01-normal-primary-r2",
            "full-campaign-source-native-com-01-normal-primary-r3"
          ]
        },
        {
          "dimension_id": "composition_and_handoff",
          "score": 9,
          "rationale": "composition_and_handoff is supported by COM-01-normal-primary immutable run evidence. Source-native runs provide hash-verified readiness, provenance, explicit failures and recovery/handoff artifacts; the out-of-root case is correctly rejected as inconclusive.",
          "evidence_ids": [
            "full-campaign-source-native-com-01-normal-primary-r1",
            "full-campaign-source-native-com-01-normal-primary-r2",
            "full-campaign-source-native-com-01-normal-primary-r3"
          ]
        },
        {
          "dimension_id": "useful_autonomy",
          "score": 8,
          "rationale": "useful_autonomy is supported by COM-01-normal-primary immutable run evidence. Source-native runs provide hash-verified readiness, provenance, explicit failures and recovery/handoff artifacts; the out-of-root case is correctly rejected as inconclusive.",
          "evidence_ids": [
            "full-campaign-source-native-com-01-normal-primary-r1",
            "full-campaign-source-native-com-01-normal-primary-r2",
            "full-campaign-source-native-com-01-normal-primary-r3"
          ]
        },
        {
          "dimension_id": "understandability_and_maintainability",
          "score": 9,
          "rationale": "understandability_and_maintainability is supported by COM-01-normal-primary immutable run evidence. Source-native runs provide hash-verified readiness, provenance, explicit failures and recovery/handoff artifacts; the out-of-root case is correctly rejected as inconclusive.",
          "evidence_ids": [
            "full-campaign-source-native-com-01-normal-primary-r1",
            "full-campaign-source-native-com-01-normal-primary-r2",
            "full-campaign-source-native-com-01-normal-primary-r3"
          ]
        }
      ],
      "evidence_ids": [
        "full-campaign-source-native-com-01-normal-primary-r1",
        "full-campaign-source-native-com-01-normal-primary-r2",
        "full-campaign-source-native-com-01-normal-primary-r3"
      ]
    },
    {
      "case_id": "COM-02-normal-variant",
      "dimensions": [
        {
          "dimension_id": "task_success",
          "score": 9,
          "rationale": "task_success is supported by COM-02-normal-variant immutable run evidence. Source-native runs provide hash-verified readiness, provenance, explicit failures and recovery/handoff artifacts; the out-of-root case is correctly rejected as inconclusive.",
          "evidence_ids": [
            "full-campaign-source-native-com-02-normal-variant-r1",
            "full-campaign-source-native-com-02-normal-variant-r2",
            "full-campaign-source-native-com-02-normal-variant-r3"
          ]
        },
        {
          "dimension_id": "correctness_and_evidence",
          "score": 9,
          "rationale": "correctness_and_evidence is supported by COM-02-normal-variant immutable run evidence. Source-native runs provide hash-verified readiness, provenance, explicit failures and recovery/handoff artifacts; the out-of-root case is correctly rejected as inconclusive.",
          "evidence_ids": [
            "full-campaign-source-native-com-02-normal-variant-r1",
            "full-campaign-source-native-com-02-normal-variant-r2",
            "full-campaign-source-native-com-02-normal-variant-r3"
          ]
        },
        {
          "dimension_id": "repeatability",
          "score": 9,
          "rationale": "repeatability is supported by COM-02-normal-variant immutable run evidence. Source-native runs provide hash-verified readiness, provenance, explicit failures and recovery/handoff artifacts; the out-of-root case is correctly rejected as inconclusive.",
          "evidence_ids": [
            "full-campaign-source-native-com-02-normal-variant-r1",
            "full-campaign-source-native-com-02-normal-variant-r2",
            "full-campaign-source-native-com-02-normal-variant-r3"
          ]
        },
        {
          "dimension_id": "state_and_error_observability",
          "score": 9,
          "rationale": "state_and_error_observability is supported by COM-02-normal-variant immutable run evidence. Source-native runs provide hash-verified readiness, provenance, explicit failures and recovery/handoff artifacts; the out-of-root case is correctly rejected as inconclusive.",
          "evidence_ids": [
            "full-campaign-source-native-com-02-normal-variant-r1",
            "full-campaign-source-native-com-02-normal-variant-r2",
            "full-campaign-source-native-com-02-normal-variant-r3"
          ]
        },
        {
          "dimension_id": "stop_and_recovery",
          "score": 9,